{
  "name": "claude-code",
  "description": "Claude Code adapter using CLAUDE.md plus optional .claude/skills mirrors.",
  "instruction": {
    "src": "CLAUDE.lizard.md",
    "dst": "CLAUDE.md",
    "sidecar": "CLAUDE.lizard-agent-layer.md",
    "mergePolicy": "sidecar-if-exists"
  },
  "skillMirrors": [
    { "dst": ".claude/skills", "description": "Claude-local skill mirror for projects that read skill folders." }
  ],
  "routingCapabilities": {
    "policyMode": "advisory",
    "nativeDelegation": false,
    "modelPinning": false,
    "modelDiscovery": "none",
    "modelSelection": "inherit-current",
    "actualModelReporting": false,
    "receiptCapture": false,
    "notes": "The portable layer provides routing guidance without assuming a specific Claude Code runtime configuration."
  }
}
