{
  "name": "gemini",
  "description": "Gemini CLI adapter using GEMINI.md plus .gemini/skills mirrors.",
  "instruction": {
    "src": "GEMINI.lizard.md",
    "dst": "GEMINI.md",
    "sidecar": "GEMINI.lizard-agent-layer.md",
    "mergePolicy": "sidecar-if-exists"
  },
  "skillMirrors": [
    { "dst": ".gemini/skills", "description": "Gemini-local skill mirror for projects that read skill folders." }
  ],
  "routingCapabilities": {
    "policyMode": "advisory",
    "nativeDelegation": false,
    "modelPinning": false,
    "modelDiscovery": "none",
    "modelSelection": "inherit-current",
    "actualModelReporting": false,
    "receiptCapture": false,
    "notes": "The portable layer provides routing guidance without assuming a specific Gemini runtime configuration."
  }
}
