{
  "name": "generic-agents-md",
  "description": "Generic AGENTS.md adapter for tools that read repository instructions but have no dedicated harness path.",
  "compatibility": {
    "instructionGroup": "agents-md",
    "precedence": 10
  },
  "instruction": {
    "src": "AGENTS.generic.lizard.md",
    "dst": "AGENTS.md",
    "sidecar": "AGENTS.lizard-agent-layer.md",
    "mergePolicy": "sidecar-if-exists"
  },
  "skillMirrors": [],
  "routingCapabilities": {
    "policyMode": "advisory",
    "nativeDelegation": false,
    "modelPinning": false,
    "modelDiscovery": "none",
    "modelSelection": "inherit-current",
    "actualModelReporting": false,
    "receiptCapture": false
  }
}
